"","Title","Author_URL","Author_Name","App_Version","Rating","Review","Date","app_name"
"288","Price","https://itunes.apple.com/us/reviews/id481434361","PersingerNadeene","4.11",2,"I love this app but I do not like only having one story free to me while all the other options cost.",2019-06-20,"calm"
"289","Good but Price is too high","https://itunes.apple.com/us/reviews/id246431759","Ellimacs","4.11",2,"I was using this and noticed I got a charge for $70 . I had ZERO idea that this was the defaultnprice, I never for a choice. To be honest it a little too much for the use I think. It's not a bad service just wish they were more up front about what the free version turns into. 😟",2019-06-20,"calm"
"290","I dig it","https://itunes.apple.com/us/reviews/id612963589","noslu","4.11",5,"I’ve been pretty okay with my anxiety lately but today towards the end it really spiked it. It took me 3 hours of trying to relax by own methods to feel even just a tiny amount better. 
I saw an add for this and though, “hey why not?”. The first session on anxiety has me back and centered. The session wasn’t even that long but it truly helped. I definitely recommend trying this out.",2019-06-20,"calm"
"291","Thank you!","https://itunes.apple.com/us/reviews/id320568864","dew100","4.11",5,"Wow!!!... Just wow!",2019-06-20,"calm"
"292","Too expensive","https://itunes.apple.com/us/reviews/id839133649","qwert3306","4.11",3,"The app is great except for the subscriptions. You have to pay $70 a year for almost everything on the app. If you don’t give them your money, the app is basically useless because almost everything is locked. If more stuff was free, my rating would go up.",2019-06-20,"calm"
"293","Amazing!","https://itunes.apple.com/us/reviews/id470795481","You can get it right aa","4.11",5,"Please add more bedtime stories for astronomy topic! Thank you!!",2019-06-20,"calm"
"294","Thank u","https://itunes.apple.com/us/reviews/id977159072","now calm","4.11",5,"It’s calming me down",2019-06-20,"calm"
"295","Not much you can do with the free version","https://itunes.apple.com/us/reviews/id1022988145","avocado257","4.11",1,"I am currently using the calm premium right now.It can be very expensive but worth it. Calm is now a part of my daily schedule and helps get rid off anxiety of daily life struggles. If you do not have the calm premium, there is not much you can do. It was annoying when the notifications popped up on the main page with a lock symbol on it. I hope they add a category for “free” or “unlocked” so people without premium could browse without the lock symbol.",2019-06-19,"calm"
"296","Be forewarned *Update","https://itunes.apple.com/us/reviews/id12291959","Livright 2016","4.11",3,"Update:
6/19/19
I sent an email to Apple Itunes and received a prompt response to my issue. 
They reversed the charges and said they I should see a credit in my account. 

Original review:
iTunes needs to fix this deceptive practice. If you are trying the one week free trial of this app please be aware, If you miss the cutoff by even one day, you are on the hook for the $60-$70. They will not refund or prorate any of the charges. Very deceptive. Apple iTunes you're counting on folks forgetting to cancel in time. Calm is offering this for $9.99 to mental health practitioners I suspect to market app to their patients for a much steeper price.  I will file a formal complaint with BBB if this isn't resolved. What a rip-off.",2019-06-19,"calm"
"297","This app is Essential!","https://itunes.apple.com/us/reviews/id230471638","K drama man","4.11",5,"This is my favorite app in the world. The lessons, the music, the stories and masterclasses are superb. I have gone through a tremendous spiritual growth the past 12 months and I was looking for an app that could compliment my teachings and new found meditation. I looked at all of them and a trusted friend told me about Calm and I’m so glad she did.",2019-06-19,"calm"
"298","So HELPFUL","https://itunes.apple.com/us/reviews/id1033231767","Lil_Gravy","4.11",5,"Seriously best app ever!!!!!!!!!!",2019-06-19,"calm"
"299","WHY PREMIUM","https://itunes.apple.com/us/reviews/id146892764","Ontargetmt","4.11",1,"YOU WANT ME TO PAY PREMIUM?! SCREW THAT!!",2019-06-19,"calm"
"300","Amazing","https://itunes.apple.com/us/reviews/id947702115","CrazCat47891","4.11",5,"This app helps a lot!!!!!!!",2019-06-19,"calm"
"301","Calm kids","https://itunes.apple.com/us/reviews/id472464090","eeveesmommy","4.11",5,"Ever since I purchased the Calm app it has not only helped me sleep, but I put it on when it’s time for my three-year-old daughters nap and when it’s time for bed and she’s usually asleep in 10 to 15 minutes! I love this app because it takes my unruly three-year-old and calms her right down for her nap!",2019-06-19,"calm"
"302","Best app ever","https://itunes.apple.com/us/reviews/id647818805","the over all experiance","4.11",5,"So this app lets you choose what you want to focus on like sleep,meditation and, self esteem. I totally recommend this app!",2019-06-19,"calm"
"303","Price","https://itunes.apple.com/us/reviews/id423672760","3747282847363","4.11",1,"The price for this stupid app is so ridiculous I had to complain about it.",2019-06-19,"calm"
"304","I love the app","https://itunes.apple.com/us/reviews/id784352216","27lliddy","4.11",5,"Its so peaceful it’s really awesome you should get this app why because it’s works so well after 1 session of this I felt so much calmer I got this app because I have anger issues and it’s really calm and peaceful get the app now and get all your anger out",2019-06-19,"calm"
"305","Costs $70 to receive all content","https://itunes.apple.com/us/reviews/id648983656","ayayayyayayayayayyayayayayyaya","4.11",1,"This app wants entirely too much money.",2019-06-19,"calm"
"306","Very limited unless you pay","https://itunes.apple.com/us/reviews/id317749812","wtfghjkl","4.11",1,"I love the idea but really? 
$70 a year? 
NO.... that in itself stressed me out. 
That’s ridiculous",2019-06-19,"calm"
"307","You have to pay, really?","https://itunes.apple.com/us/reviews/id369601200","Gbsjinbdvahhb","4.11",1,"Downloaded and used it for 30 seconds before it asked me to pay for it. Now it’s deleted. I’ll get the same thing on YouTube for free.",2019-06-19,"calm"
"308","You have to pay for EVERYTHING","https://itunes.apple.com/us/reviews/id1036612745","Nathian&nya","4.11",1,"Why do you have to pay for everything, just lowballing people if I can give the a zero star a would this doesn’t even deserve a star",2019-06-19,"calm"
"309","more free stuff","https://itunes.apple.com/us/reviews/id444972402","BritneyXOX :3","4.11",1,"i think it’s a good app but i don’t have money so i’d appreciate it if they were free",2019-06-19,"calm"
"310","A 70$ trap","https://itunes.apple.com/us/reviews/id43823202","Lovepeacehappinessrevier","4.11",1,"Don’t get the app don’t bother unless you want to pay 70$ for all but the most bare bones features. Extremely disappointing. I never write app reviews but this was so bad I had to spread the word.",2019-06-19,"calm"
"311","Calm","https://itunes.apple.com/us/reviews/id994608141","ALS12345678910","4.11",5,"Best app ever!",2019-06-19,"calm"
"312","Deceptive","https://itunes.apple.com/us/reviews/id223324871","Dfern12","4.11",1,"I downloaded the app and started a “free” 7 day trial. Never did I sign up for anything else, nor did the app state I would be charged. In fact, the app on the Apple store states that if you download the app you will not be charged. Sure enough, I get charged $69.99 for a yearly subscription I NEVER signed up for. Hit the “report a problem” button, wrote what happened and that I want a refund, and instantly the Apple message stated I was not elegible for a refund. Complete BS.",2019-06-19,"calm"
"313","Sleep","https://itunes.apple.com/us/reviews/id1023325779","😍☺️😭😍☺️😭","4.11",5,"This really helps me go to sleep. I would totally recommend this app",2019-06-19,"calm"
"314","Cool down","https://itunes.apple.com/us/reviews/id689774179","michvill","4.11",5,"I use this sometimes for a cool down break when I’m upset.",2019-06-19,"calm"
"315","Dasani","https://itunes.apple.com/us/reviews/id1035660677","sanilove05","4.11",5,"It’s sooooo relaxing.🥰💕",2019-06-19,"calm"
"316","I can’t afford $60 a year...","https://itunes.apple.com/us/reviews/id43612336","binarydaddy","4.11",1,"I suffer from sleep
Apnea and I just want a thunderstorm sound I can fall asleep to. Best sleep in years with this app but it was a pipe dream since I heard it one night and that’s it. Now I can’t listen to it even for another few nights to confirm it works and now I’m spending my sleep time writing this review because I CANT SLEEP🤬😡",2019-06-19,"calm"
"317","Calm","https://itunes.apple.com/us/reviews/id742515089","Dyhhhf","4.11",5,"This is an amazing app, I mostly use it for sleep, works every time. I recommend it.",2019-06-19,"calm"
"318","🤓","https://itunes.apple.com/us/reviews/id830832255","ohheyyyy_talia","4.11",1,"This app sucky My mother trucking bootay Whole 🐒
            💩   
            💩
            💩
            💩",2019-06-18,"calm"
"319","Loved it! Until it stopped working!","https://itunes.apple.com/us/reviews/id297477651","Rdog206wa","4.11",1,"Been a paying costumer for almost 2 years and as of now, I try to get it to open and it just keeps closing on its own. I’ve tried everything! Just want to cancel my fee now but CAN NOT EVEN OPEN IT!",2019-06-18,"calm"
"320","Calm","https://itunes.apple.com/us/reviews/id605500554","Nurse self love","4.11",4,"I really love this app it truly works with my inner self. Every session makes me want another session and there are so many to choose from. However, I did rate the app 4stars because I wish it allows you to make small monthly payments instead of 1 yearly payment. I won’t be keeping the app after my trial because of the large expected payment. If you have the funds right now I recommend using and keeping the app after your trial. If not I recommend you waiting until you can afford the $70 to start your trial because it is an awesome app and you will want to buy it. Don’t tease yourself like I have because the app is amazing.",2019-06-18,"calm"
"321","I LOVE THIS APP","https://itunes.apple.com/us/reviews/id342398085","Dawn_Darkness4","4.11",5,"It’s really peaceful and helps be focus and continue throughout the day.",2019-06-18,"calm"
"322","Don’t bother unless you want to subscribe","https://itunes.apple.com/us/reviews/id599118329","Daisy306","4.11",2,"This is a slick looking app, but there is nothing to do in it unless you subscribe-so, no free calm",2019-06-18,"calm"
"323","What a waste of my time.","https://itunes.apple.com/us/reviews/id37737947","Natiri","4.11",1,"$70 / year, locked content you have to pay extra, doesn’t even play sound when turning off the screen.",2019-06-18,"calm"
"324","Calm","https://itunes.apple.com/us/reviews/id763911065","кαℓуѕтα ℓєє","4.11",5,"It’s really nice but I wish everything was free.",2019-06-18,"calm"
"325","Sigh","https://itunes.apple.com/us/reviews/id817317059","the mitochindria is","4.11",3,"Is there like a free version for struggling college students? It’s been great but I can’t afford this especially when I’m in college and don’t work for now.",2019-06-18,"calm"
"326","Not worth it unless you want to pay for premium.","https://itunes.apple.com/us/reviews/id1036235290","briar244","4.11",1,"Just to expensive. And the amount of things you have access to if you do not buy the premium is just ridiculous. Why make a free app and then only allow us to access maybe 10% of it with out paying? I thought I was getting a free app to help me sleep but it turns out unless your willing to pay almost 70 dollars a year, you might as well not download it.",2019-06-18,"calm"
"327","Best app ever","https://itunes.apple.com/us/reviews/id958260522","ash sam soso","4.11",5,"I have never been so interested in a app so calm.I am speechless this is the greatest app ever!",2019-06-18,"calm"
"328","It was decent until...","https://itunes.apple.com/us/reviews/id1036219087","Cee Cee 63","4.11",1,"The app is fine. But I clicked the 7 day free trial...or what I thought was a free trial. About an hour later I got an email receipt from Apple saying I’d been charged for an annual membership and Apple instantly decided I couldn’t get a refund. So, now I’m stuck with this membership...the good news is now I REALLY need to meditate due to this unwanted expense. 

User beware: 

“free_trial_yearly_one_week_2018_04_25_usd_70”

is not actually free. Not sure why the word free is listed at all. Don’t click it. 😫",2019-06-18,"calm"
"329","Everything is locked","https://itunes.apple.com/us/reviews/id729501585","174539","4.11",3,"It’s not free for me on the I phone X everything is locked I can’t listen to my music while I sleep it is so annoying I can’t listen to “Milky Way”",2019-06-18,"calm"
"330","I DID NOT SIGN UP FOR A YEARLY SUBSCRIPTION","https://itunes.apple.com/us/reviews/id575325024","Benjs29","4.11",1,"I came to find a $69.99 charge on my bank statement from an app I used ONCE! I did not agree to a yearly subscription for this app and I want a refund IMMEDIATELY! This is absolutely ridiculous, I can’t believe that an app meant to calm you ended up being the most stressful download I’ve ever made. $70 gone that could have be used to keep food on the table.",2019-06-18,"calm"
"331","Overpriced","https://itunes.apple.com/us/reviews/id727692896","Nicole&&22","4.11",1,"$70!???? Sheesh!! (Deletes app)😒😒😒",2019-06-18,"calm"
"332","Calm","https://itunes.apple.com/us/reviews/id270669751","harpydoodle","4.11",5,"awesome sooooooo relaxing",2019-06-18,"calm"
"333","Absolutely Terrible","https://itunes.apple.com/us/reviews/id330552013","Luna-Nova","4.11",1,"I just wanted some background noise to fall asleep to when I was away from my fan. You can’t do anything without “a premium subscription”, you can’t listen to music, mediation, literally everything except for one sleep story is locked. That’s stupid, I could understand some things in the app but everything except ONE sleep story is premium only. I regret downloading this app and wasting my time on it.

Sincerely,
A very angry customer",2019-06-18,"calm"
"334","I love it but...","https://itunes.apple.com/us/reviews/id584521986","_.alex_hall._","4.11",3,"Ok, don’t get me wrong i love the app so much, i use it almost everyday to help keep my cool after a long school day(breathing) or to fall asleep(backgrounds) but premium is so much.. as a student everything is already SUPER expensive, and now you’re telling me i have to pay just to get some REST excuse me but no",2019-06-18,"calm"
"335","Awesome","https://itunes.apple.com/us/reviews/id788879096","calmnessisawsome","4.11",5,"It is AWSOME!!",2019-06-17,"calm"
"336","Unwanted","https://itunes.apple.com/us/reviews/id571415258","debbybimz","4.11",1,"I no longer want this app please delete it before you all charge me $70.",2019-06-17,"calm"
"337","Horrible","https://itunes.apple.com/us/reviews/id702322923","bolivia olivia","4.11",1,"If you don’t get the premium version it is absolutely defective if you use a soundscape and press see all they all become locked it’s the worst thing I’ve seen",2019-06-17,"calm"
"338","Need to keep 7 days of calm for free","https://itunes.apple.com/us/reviews/id10753327","Boberuska","4.11",5,"Love the app and used to tell all my friends to try the free “7 days of Calm” even a couple times before they make a decision. Once they did that they were hooked and usually joined — as the mindfulness part after a couple days is what really grabs you and sets this app apart.   Unfortunately someone has now made the decision to force you to put up funds and “try it for free for 7 days” after the first meditation — people new to meditation aren’t sold after that first session. Please bring back the 7 days before the sales pitch! Those 7 days — even if someone repeats them — were the secret to your success.",2019-06-17,"calm"
"339","Sneaky...","https://itunes.apple.com/us/reviews/id479632162","Hale.K.","4.11",1,"Be careful with renewals.

I downloaded this with the knowledge of having less accessible features. But I tried the free trial just to see what it would be like (but I was still restless even while using the app so I had planned to delete the app, but I kept giving it a shot)

After the free trial ran out, I was NOT told. It charged me $69.99 out of my account. 

I was unaware and didn’t permit this purchase. I cancelled the subscription right away (so I barely and did not use the app under the subscription I paid for). Based on the reviews you won’t get a refund. If I don’t get a refund that would be a great disappointment :(",2019-06-17,"calm"
"340","Calm your world! It truly makes a difference, read on...","https://itunes.apple.com/us/reviews/id315329362","DonFromTowson","4.11",5,"I learned TM In the 1980’s and after a few years of practice, I began skipping sessions(2 per day) then a whole day then just kinda skipped it all together. Laziness plain & simply. Hard to see the bang for my buck(time spent meditating), so to speak!

Well now 30 years later & i have debilitating pain due to psoriatic arthritis. I ended up in past 15 years having both knees replaced, one hip replacement replaced (only lasted 15 years, that one was 16 years old).  And a hernia op.

A few years ago I ended up getting an infection in fatty part of upper thigh. “A nasty place to get infection”  my dr told me,  “hard to get rid of an infection in that area”. I take Humira and the two don’t mix...my primary care physician prescribed antibiotics, one month later still had infection and my dr prescribed stronger antibiotics. Again a month went by with no changes in infection...finally my dr prescribed surgery to have infection removed...last thing to try, cut it out! I didn’t want to have to go the surgery route. 

So I remembered my Transcendental Meditation teachings and with nothing to loose I thought I’d give it a try. I also happened upon Calm, the app, which not only had a timer with selectable time duration & background sounds you can choose from but it also had a huge variety of specific “talk you through” meditation practices from Focusing your personal energy, stories to put you to sleep, inner peace to step by step meditation for beginners (not only beginners but specific aged beginners) like 3-5 y/o, 6-9 y/o, up thru adult. Just barely scratching the surface of the app. It has sleep stories, special music, and lots of guided 

So I began meditating again and am now using Calm to guide me & keep track myself! Calm provides very helpful feedback that keeps track of time spent & offers kind words of encouragement to help you continue. It is very helpful and I’m finding the statistics was the reinforcement I was needing to help me to continue!

Infection gone!!! So about 6 weeks after restarting twice daily transcendental meditation for 15-20 minutes each time the infection was gone, simply gone! Quieting my mind 2 times a-day for 6 weeks did something MAGICAL to my mind & body‼️ 

So let Something Calming into your life, you never know what you can do if you don’t try!",2019-06-17,"calm"
"341","Dear Calm...","https://itunes.apple.com/us/reviews/id686241007","ILoveCalmApp","4.11",5,"This has got to be one of the best, most helpful apps in the App Store. The meditation sessions are amazing and help me out in my life so much. Now I don’t always need to use the app for meditation. The music is beautiful and calming. The sleep stories are so interesting and always get me to fall asleep. Calm body is very fun and relaxing to do and I love the exercises! The only problem I have is that I don’t have Calm Premium. Now I can’t access much of anything anymore! I really hope that more things will come out for Calm users without paying for Premium. Overall, Calm is an amazing app that everyone should get. Thank you Calm!!",2019-06-17,"calm"
"342","Best decision I have made in a long time","https://itunes.apple.com/us/reviews/id17137370","Hildecpa","4.11",5,"This App has brought so much peace into my life. I recommend it for anyone who deals with anxiety.  My anxiety level has improved significantly.",2019-06-17,"calm"
"343","Soothing Focus","https://itunes.apple.com/us/reviews/id1035206191","Dr. Shhh","4.11",5,"It’s my first meditation session with this app.  I use another meditation app as well. I like the background noises in this one...they are soothing as well as calming, along with the guide you’re able to gently focus your thoughts.",2019-06-17,"calm"
"344","This app isn’t free.","https://itunes.apple.com/us/reviews/id134987957","MellMelllMellll","4.11",1,"I honestly don’t even know why this app has so many 5 stars. Are all of these people paying the $70 subscription for this app? I ask because this app seems great but EVERYTHING is unlocked by joining premium. 3 sounds are free and 1 story. There are so many comparable apps that, even if they’re $3.99 offer more without a subscription. I really wish there was more free content. Or this was at least a one time purchase and not a $70 subscription. Great app but there’s no use without the subscription why even make the app free?",2019-06-17,"calm"
"345","Hello","https://itunes.apple.com/us/reviews/id504335891","lillybdhe","4.11",5,"Does anyone want to get me the full version? Thank you🙌🏽👏🏼 $lildlc",2019-06-17,"calm"
"346","Ughhh","https://itunes.apple.com/us/reviews/id969203562","gianna_._,","4.11",1,"Ok I am sorry that I don’t want to but the trail or whatever... Nothing is free!!!! I scrolled threw the hole thing and guess what?!!!? Nothing is free!!!! Ughhhh I would leave no stars if I could🙄",2019-06-17,"calm"
"347","Thank you","https://itunes.apple.com/us/reviews/id1035806507","becky🥰","4.11",5,"It just my day one using the app and am in love 💓💓💓💓",2019-06-17,"calm"
"348","😀😘🤔","https://itunes.apple.com/us/reviews/id1001700813","hfdyihf","4.11",5,"This game is awesome it will help you go to bed and there is another one called mushy",2019-06-17,"calm"
"349","Free?  Think again","https://itunes.apple.com/us/reviews/id15631583","twiener","4.11",1,"For a free app, this is anything but free.  Think again about getting this if you were looking for a meditation app that would provide multiple options without paying a dime.",2019-06-16,"calm"
"350","That is cool!","https://itunes.apple.com/us/reviews/id969507369","DonovanLouiseWagner","4.11",5,"This app is making me relax my Body!",2019-06-16,"calm"
"351","Best App!!!","https://itunes.apple.com/us/reviews/id941465495","Sejahc25","4.11",5,"I use this app to treat my insomnia, I pick a story or sometimes a song and within the first few minutes I’m sound asleep. Ever since I started using calm I’ve had the best sleep!!",2019-06-16,"calm"
"352","BE CAREFUL","https://itunes.apple.com/us/reviews/id299958533","beccabluejeans18","4.11",1,"Be VERY careful with automatic renewal.......you will be charged second year and CAN not get a refund if you miss the date.  Ripoff",2019-06-16,"calm"
"353","Price vs Content","https://itunes.apple.com/us/reviews/id35703401","Andrew Henry","4.11",4,"It’s a great app and I enjoy it.  My only issue is that I thinks it’s over priced for the volume of content",2019-06-16,"calm"
