"","Title","Author_URL","Author_Name","App_Version","Rating","Review","Date","app_name"
"145","This is awesome","https://itunes.apple.com/us/reviews/id691161198","haeleybouchard","4.11.1",5,"I feel so much more calm while using this app and I’m only on day two of seven days of calm I do recommend this if u have sleep issues or a lot of stress and anxiety I’m only 12 and I have all those things but this really is helping with anger and stress and anxiety.",2019-06-29,"calm"
"146","Did not sign up but got charged","https://itunes.apple.com/us/reviews/id9090064","Weezeejoe","4.11.1",1,"I downloaded this to try one night a long time ago. I never signed up but just got charged $60 for it. Beware. They’re going to take your money whether you agree to it or not.",2019-06-29,"calm"
"147","Great!","https://itunes.apple.com/us/reviews/id284747663","Jl24k","4.11.1",5,"Just great! With everything . The free calm offers still a great selection.",2019-06-29,"calm"
"148","Scam","https://itunes.apple.com/us/reviews/id971531802","sssassorrreeen","4.11.1",1,"They said it’s free on the ad and they literally do NOTHING unless you pay 70 bucks first!
Enough for me to judge their genuity : Scam
Nice try I rather to a google search for FREE",2019-06-29,"calm"
"149","Get the app","https://itunes.apple.com/us/reviews/id488078425","guycilia","4.11.1",5,"I fell asleep so quickly and woke up refreshed",2019-06-29,"calm"
"150","Not free","https://itunes.apple.com/us/reviews/id170982730","Bigt9847","4.11.1",1,"The app is  free with the option of in-app purchase but, not the case ,soon as you sign up it offers a 7day trial. 
Not for me. Deleted, immediately.",2019-06-29,"calm"
"151","Trickery","https://itunes.apple.com/us/reviews/id37285584","KobesHoes","4.11.1",1,"It tricked me into paying for a “trial” and I didn’t want to.  If it’s a recurring fee then there’s a real problem.  Beware!",2019-06-29,"calm"
"152","What a app","https://itunes.apple.com/us/reviews/id962799290","🐺Amber🐺","4.11.1",5,"This app is so good but dose cost I did the audio book Blue hold and it’s good I fell asleep in seconds I do recommend this App",2019-06-29,"calm"
"153","Thanks for nothing app.","https://itunes.apple.com/us/reviews/id181789871","Homeless Man With Rabies","4.11.1",1,"I’m homeless so like this helps in like stop so like I like yos app so like yeah I love it’s ok I just love yo app mixing",2019-06-29,"calm"
"154","I love it😍","https://itunes.apple.com/us/reviews/id43734235","Sean8102","4.11.1",5,"Calm helps me so much with worries and stuff I need to do and don’t want to do it relaxes and calms me it has made a big change for my stressing and worrying I have started day one for meditation and it is great I feel like I go somewhere else and it is a great feeling for when you are stressed or worried or anything you should definitely get calm in my opinion because it has helped me so much it is like awesome because when I meditate or go to sleep now I am not stressed or worried or have stressful feeling or thoughts but if you are considering of getting calm you should it is the best thing ever",2019-06-29,"calm"
"155","Uninstalled the app in 5 min","https://itunes.apple.com/us/reviews/id539356096","BalloolMb","4.11.1",1,"They want your money, one week free with like 1 story only (bad one), then they charge you 70 dollars a year ! 
Listen to me, you want calming videos, stories and music, YouTube it ! Free and perfect. Good luck",2019-06-28,"calm"
"156","BP","https://itunes.apple.com/us/reviews/id450219112","Outerlimts","4.11.1",5,"I love app it the best app for clearing my Thoughts",2019-06-28,"calm"
"157","This app is AWSOME!","https://itunes.apple.com/us/reviews/id954455492","Danyale Kelis Rainer","4.11.1",5,"This app keeps me calm all the time! When I get mad I like to use this app to keep me calm!! This app always gets inside my head when I feel mad or something!! So thank u sooooo much for making this app I will use it when I need it <:)",2019-06-28,"calm"
"158","Calm","https://itunes.apple.com/us/reviews/id960459253","midnight wolves0","4.11.1",5,"I literally just started, and I’m already seeing improvements on my mood! This really works!",2019-06-28,"calm"
"159","Immediately got me to sleeep","https://itunes.apple.com/us/reviews/id1040073427","Isabella Ondrasek","4.11.1",5,"I was tired but couldn’t go to sleep so I got calm cuz all my friends have it. Best sleep ever!!!! You won’t regret getting this app!!!",2019-06-28,"calm"
"160","TO DIE FOR !!!","https://itunes.apple.com/us/reviews/id494665230","BRUH this stinks 👎🏼jeans god","4.11.1",5,"thank this shi so much ughhhhh 🥺",2019-06-28,"calm"
"161","Awesome","https://itunes.apple.com/us/reviews/id656241533","Sav_N","4.11.1",5,"Super soothing. 100% recommend if you have trouble getting to sleep (or if you need a stress reliever).",2019-06-28,"calm"
"162","Gracias","https://itunes.apple.com/us/reviews/id632842169","Jordan Romo","4.11.1",5,"No creí que una app pudiera traer tanta buena energía y mejor inteligencia emocional, espero mucho de esta app así que sorprendan a más personas que ocupan darse cuenta de el arte que nuestro cuerpo pasa día a día, así como a estar agradecidos por el simple de hecho de estar vivos y se nos olvida ☀️🏡",2019-06-28,"calm"
"163","Cost money","https://itunes.apple.com/us/reviews/id416319689","PaolaAnn😋","4.11.1",1,"Very disappointing that there were only 2 free features. Everything else is locked and you can’t open it until you agree to sign up for 7 days of free trial followed by $69.99. You’re better off watching relaxing videos on YouTube.",2019-06-28,"calm"
"164","Manage subscription","https://itunes.apple.com/us/reviews/id240912489","Chut101","4.11.1",1,"I accidentally hit a button and I was automatically subscribed, I tried several time to cancel the subscription with no luck. This is not a user friendly app.. you can easily spend hours trying to figure out how to unsubscribe. Send an email to the developer to help me out. Waiting to here from him/her.",2019-06-28,"calm"
"165","Amazing!","https://itunes.apple.com/us/reviews/id104800785","Alisha K.K.","4.11.1",3,"I used to have trouble going to sleep. I kept tossing and turning but then I saw the advertisement that Calm sent out and I got really interested in the app. I always listened to the stories even in the day. I loved this app!",2019-06-28,"calm"
"166","Calm","https://itunes.apple.com/us/reviews/id19962102","booytooy","4.11.1",5,"It helps go to sleep",2019-06-28,"calm"
"167","The most soothing (and quick) bedtime story for my 4 toddlers","https://itunes.apple.com/us/reviews/id743342398","MotherofFourSmallBoys","4.11.1",5,"I absolutely love “sleepy paws” melodic bedtime story! It had 3 of my 4 boys asleep within 5 minutes and was enjoyable and very calming for me as well! This story and the variety of calming sounds aided my decision to continue through my trial period and extend on an annual basis.  If you are wondering what the hype is about on Facebook sponsored ads, I definitely recommend exploring all the options and taking advantage of the trial period.",2019-06-28,"calm"
"168","Not all it’s cracked up to be","https://itunes.apple.com/us/reviews/id805322067","Dappled pelt123","4.11.1",2,"It’s a good app, but only if you want to pay $69.99 a year. The $69.99 is to get Calm Premium, and that gives you a lot of nice choices and cool options like stories to listen to, different scenes and music and meditation exercises. But let’s say you don’t want to pay that much, or you can’t like me. You only get to listen to two stories, and that’s it. There are meditation exercises called 7 Day Calming or something like that. Each meditation exercise has 7 levels. But if you can’t pay the almost $70 a year, then you can do only the first level. And there are only like 4 levels that you can do if you are not subscribed to Calm. So if you don’t wanna pay $70 a year, all you get to do on this app is listen to two stories, and do four different exercises. Mind you, this is out of the like 100 exercises and 50+ stories there are. Also you can’t change the music or anything. I wish this app wasn’t so focused on money or else it would be a great app. But you have to pay a lot of money if you want to meditate. It’s not fair, and some people really need to meditate, but can’t because they don’t have enough money. Also, it shows on the pictures that all the exercises are unlocked, but that’s only AFTER you pay $69.99. Just warning you. Overall I think this could be way better if it was 100% free. I know a lot of people who have been discouraged and haven’t gotten this app because of the hefty prices. It’s a nice idea and I do like the colors and the ways it’s organized. 

         P.S I’m not going to say you shouldn’t get it-that’s up to you. But I’m just saying what it’s like when you get it.",2019-06-28,"calm"
"169","Payments","https://itunes.apple.com/us/reviews/id187849577","BearBoyd","4.11.1",1,"I’m sorry, I like the idea but I’m not paying almost 70 dollars a year for this. If I can pay a low price for a few items here and there when I feel like gaining more content as I choose that would be one thing but not paying for it for a year for content I might not even use.",2019-06-28,"calm"
"170","I keep missing my alarms","https://itunes.apple.com/us/reviews/id119491521","King⚡Suav","4.11.1",5,"I thought I was just getting a better deeper sleep, but the app overrides my set alarms

Otherwise 😴😪😪😴😪😴😩😫😪😴",2019-06-27,"calm"
"171","Never could meditate till this app","https://itunes.apple.com/us/reviews/id40904705","Rosebud TX","4.11.1",5,"Meditation is so not natural to me. Tried in the past, never worked. Saw an ad for Calm somewhere that struck a note w/ me and decided to give it a try for a week. Whatever it is about the Calm app actually works for me. My mind and body soak up those lovely ten minute sessions like a sponge. After a week I paid for the extended version and it’s probably the only app I don’t regret paying for. The short exercise sessions are great too. So happy I gave Calm a try after so many failed meditation attempts in the past. I just did a session, went into it heart literally racing—every time I think it’s not going to work, but it has. Try it. I’ve stuck with it for months now and I really love it.",2019-06-27,"calm"
"172","Very Thankful","https://itunes.apple.com/us/reviews/id1016903241","Belle Solis","4.11.1",5,"I needed to be calm during the most difficult time in my life. Thank you so very much for bringing serenity to my mind, body and soul, but most importantly my heart....

Belle",2019-06-27,"calm"
"173","Calm","https://itunes.apple.com/us/reviews/id749319357","LordYungDaggerD*ck","4.11.1",5,"The name says it all it you a free way to bring mindfulness in to your life and reduce stress and sleep deprivation on an impressive level this is the app for you",2019-06-27,"calm"
"174","Great App! Premium is too Expensive","https://itunes.apple.com/us/reviews/id265593686","Emma Braten","4.11.1",4,"The app is wonderful and I enjoyed it very much but the premium was too much money. I am willing to spend anywhere from $2-$5 per month on an app like this but $15 is too much!",2019-06-27,"calm"
"175","Love this App!","https://itunes.apple.com/us/reviews/id488243287","Trujourney","4.11.1",5,"This app allows me to be more intentional and more organized about my self reflection. I recommend this to App to all.",2019-06-27,"calm"
"176","Don’t use trial. Automatic billing unless you cancel","https://itunes.apple.com/us/reviews/id345466013","sulligisard","4.11.1",1,"I hate apps with automatic billing unless you cancel in time. They will not refund. It is shady and sad.",2019-06-27,"calm"
"177","Waste of space on phone","https://itunes.apple.com/us/reviews/id176803641","smadden67","4.11.1",1,"You only get 1 free story. Everything on here costs money & it’s not cheap either. Use YouTube & save money & space on device",2019-06-27,"calm"
"178","Very misleading","https://itunes.apple.com/us/reviews/id14900084","Nannynewknee","4.11.1",1,"I downloaded the app excited for a new meditation resource. You can download the app for free but then they charge $70 a month. Or $400 for lifetime access. It looks like a great app, but didn’t explore it at all due to the high cost. Thanks, but no thanks!",2019-06-27,"calm"
"179","Not a free trial","https://itunes.apple.com/us/reviews/id714080138","x2buku","4.11.1",1,"They charge you even if you cancel subscription before the trial ends",2019-06-27,"calm"
"180","Calm is the best","https://itunes.apple.com/us/reviews/id952518966","pretzel fun","4.11.1",5,"Calm is the best because it has amazing meditations for us to use at night",2019-06-27,"calm"
"181","Calm","https://itunes.apple.com/us/reviews/id278465244","kimberlybotello","4.11.1",5,"I like calm but it gives you a few options to choose from if you want to read a book that you think is good you can’t you have to pay so that you can read it.",2019-06-27,"calm"
"182","Life changing","https://itunes.apple.com/us/reviews/id600806152","lilguwopthekid","4.11.1",5,"I use this app a few times and I’m getting it again because it helps me sleep",2019-06-27,"calm"
"183","More narrator diversity needed","https://itunes.apple.com/us/reviews/id154343544","Athena2537","4.11.1",3,"I was excited to get the subscription because it looked like there was a large variety of meditations, But they are all done by one woman, so if you don’t like her voice (which I don’t) you are out of luck. The bedtime stories are fun, they have some great narrators for those, but that wasn’t the point for me. I’ll be unsubscribing.",2019-06-27,"calm"
"184","good but...","https://itunes.apple.com/us/reviews/id504734519","ttaleeyy","4.11.1",1,"its only the best unless you purchase a subscription. theres not much you can do if you dont buy it so...",2019-06-27,"calm"
"185","Horrible APP Don’t Download!","https://itunes.apple.com/us/reviews/id217136614","nikkibellalove","4.11.1",1,"Was charged almost $80 without being aware of the change and calm and apple wont refund! So disappointing",2019-06-27,"calm"
"186",".—.","https://itunes.apple.com/us/reviews/id959582588","EmaleeAllen","4.11.1",1,"I only got this app to help me sleep but the all the music cost money and that really made me upset bc my parents don’t want me using money on apps and so I can’t unlock it all so this app just seems pointless for me and I honestly don’t even want to give it a star bc of that but yeah...",2019-06-27,"calm"
"187","Keep freezing on my iPhone 6","https://itunes.apple.com/us/reviews/id25406875","1streviewonthevoice","4.11.1",2,"Since the previous version was downloaded onto my iPhone the app constantly freezes and times out. Please fix this bug. I paid for the entire year and now this is the first time I can’t even open the app. HELP!",2019-06-27,"calm"
"188","Struggling a bit","https://itunes.apple.com/us/reviews/id319952716","*69 :D","4.11.1",5,"I’m having a little trouble finding something That works for me. After surgery I found an app that let me combine sounds to make my own white noise, and that worked wonders for me for a time. So far the stories and soundscapes just haven’t had an affect on me",2019-06-27,"calm"
"189","Beware of free trial - they will charge you early for a whole year","https://itunes.apple.com/us/reviews/id267042835","clthokie","4.11.1",1,"Thought I had a 7 day free trial but it is really a 6 day trial at best.  They charge you for the over priced subscription before the trial ends.  Had to spend several hours on the phone with Apple support trying to get it refunded!",2019-06-27,"calm"
"190","This is so great","https://itunes.apple.com/us/reviews/id929955655","Hi 🅿️💯‼️","4.11.1",5,"I came from a 3 hour drive of a trip and was really tired and I was going to read a book but I couldn’t stay focused so I used this and it helped a lot so now I’m going to sleep good night",2019-06-27,"calm"
"191","Horrible app","https://itunes.apple.com/us/reviews/id544235862","Wwmur12","4.11.1",1,"You can’t even experience the app without purchasing more options!",2019-06-27,"calm"
"192","Calm","https://itunes.apple.com/us/reviews/id975842470","emily weisiger","4.11.1",5,"After I am done meditating I feel so relaxed I am so calm and all my worries have faded I love this app because it has helped me get rid of all the worries and feelings that are trapped inside me of me",2019-06-26,"calm"
"193","Life changer!!","https://itunes.apple.com/us/reviews/id674980308","stylish4less","4.11.1",5,"I cannot day enough wonderful things about using this app!! It’s been a year now, and this app has allowed me to reach a level of personal care that I have been craving since my teens and 20’s... and I’m finally finding it in my 40’s🥰.... it has made it more accessible to do these meditations on my breaks from work or and especially during really emotional days, when I seem to need it the most! Thank You Tamara Levitt and the many others involved in creating and contributing to this app!! Your beautiful words and thoughtful care you put into each one is truly life changing! I look forward to my daily calm every morning and evening!! Thank you from one deeply grateful and compassionate heart to your truly compassionate heart!♥️❤️🥰✨~ Shaun from Santa Cruz, Ca.",2019-06-26,"calm"
"194","New User","https://itunes.apple.com/us/reviews/id524097528","amosc@spencerthekool","4.11.1",5,"The app is user friendly and I already feel more calm.",2019-06-26,"calm"
"195","Calm","https://itunes.apple.com/us/reviews/id209967889","LTGSPEC","4.11.1",1,"App is pretty useless unless you pay $70. Must of content is locked unless you sign up.",2019-06-26,"calm"
"196","Charges you without notice or refund","https://itunes.apple.com/us/reviews/id29306797","kayto12","4.11.1",1,"This app charged me $60 for a years subscription.  Neither Apple nor the app will offer a refund for this auto renew - I barely used the app and certainly wouldn’t want to  spend $60.  Very bad practice for customer satisfaction!!!!",2019-06-26,"calm"
"197","Too expensive","https://itunes.apple.com/us/reviews/id292176643","Moni3324.","4.11.1",3,"Love the app and the few first sessions you receive. But the yearly cost is way too much.",2019-06-26,"calm"
"198","Pay","https://itunes.apple.com/us/reviews/id976230346","🌈puppies/sleep/eart🌈","4.11.1",4,"It makes you pay but it dose give you 2 free ones and a 7 day trial so I gave it a 4 out of 5",2019-06-26,"calm"
"199","Too expensive","https://itunes.apple.com/us/reviews/id106488407","BoomerSooner1969","4.11.1",1,"I go into the app and can do one thing before having to pay 
Not my type of app",2019-06-26,"calm"
"200","Energizing","https://itunes.apple.com/us/reviews/id196501663","71770","4.11.1",5,"Nice way to start the day, even before getting out of bed",2019-06-26,"calm"
"201","Please Fix Tech Glitches","https://itunes.apple.com/us/reviews/id713778874","AMBootz","4.11.1",1,"Please fix the app. It crashes after 2-3 mins of use (that includes meditations, sleep stories, or writing a comment in your support center smh). This has been happening on an off for 6 mos. I have an iPhone 6, the latest iOS, and have deleted and reinstalled this app 5x so far because of this issue. 

This is turning out to be a very poor investment. The content is fine, but when it crashes every few minutes, or when I can’t access downloaded content, it’s not useful and def not worth the money I spent for your product.",2019-06-26,"calm"
"202","It’s very calming.","https://itunes.apple.com/us/reviews/id341367303","RED01000","4.11.1",4,"I’ve been using calm I guess 2yrs. It really helps to sleep and keep urself at peace.  I enjoy it.",2019-06-26,"calm"
"203","Not worth the download","https://itunes.apple.com/us/reviews/id883755619","abbiecow","4.11.1",1,"So I saw a ad for this app and thought cool let’s give it a go... when you download the first thing they ask after logging in is if you want to try a free trial for the premium version Which is 69.99 for a year and if you don’t do the premium version you only get 2 free options I think this app is stupid if your not going to spend 69.99",2019-06-26,"calm"
"204","Wonderful","https://itunes.apple.com/us/reviews/id968167056","naninie","4.11.1",5,"Amazing I have no words for it it help my self esteem and anxiety",2019-06-26,"calm"
"205","Be free","https://itunes.apple.com/us/reviews/id303759788","Gamboa All 22","4.11.1",4,"Be free please 🙏🏻",2019-06-26,"calm"
"206","Give yourself ten","https://itunes.apple.com/us/reviews/id267416808","Melloe old dude","4.11.1",5,"That is all a Calm session takes.  You can do a session anywhere and at any time.  The sessions will mellow you out the more you do them.  You deserve a ten minute break like I am going to take right now,",2019-06-26,"calm"
"207","Think Twice About Subscribing!!!","https://itunes.apple.com/us/reviews/id11615347","DYumei","4.11.1",1,"I purchased Calm last year. Used it a couple months and stopped. It’s nice, but it just didn’t work for me. But I paid for it so I thought I’d work with it. I wound up just never using it for the next 9 - 10 months and forgot about it. BIG MISTAKE.

I Should Have Canceled Right Away. Life happens. For me it was medical leave and loss of job. This wasn’t on my mind. 

A year later, I look at my subscriptions for another reason, and am mortified to see Calm is set to renew that day! Tried to cancel immediately. It did cancel — for next year. The payment hadn’t even gone through yet. It was pending. But iTunes wasn’t letting go.

Tried to request a refund. ITunes said i was SOL, it didn’t meet the requirements for a refund and gave me a link to terms and conditions for subscriptions. I read it. There’s nothing in there about refunds for accidental renewals positive or negative. 

But evidently, in practice there is NO GRACE PERIOD for accidental renewals. 

This is not rocket science. ITunes can easily grant a grace period and refund. Other companies of reputation, integrity and good customer service do that. My daughter got a refund promptly from Master Class after she realized she got charged for a yearly subscription renewal 2 days after the charge went through. But iTunes refused to refund a renewal that was caught on the same day. 

So I’m charged another $63 for an app I didn’t even like that much and barely used and likely will not use again. 

I’ve canceled all my other paid subscriptions with iTunes. I figured they made enough off of me. 

If you want to use Calm, set yourself a reminder a year ahead when it’s time to renew. It’s an expensive app and mistake.",2019-06-26,"calm"
"208","KNOW YOU WILL BE CHARGED $75","https://itunes.apple.com/us/reviews/id128224029","Kaaawachris","4.11.1",1,"An app that charges you $75 dollars if you don’t quit before the seven day trial!!  Even if the app has wonderful use and content, I can’t open the app without thinking “they duped me into getting a subscription and charged me $75 without disclosing it openly.  I am pretty frustrated which is ironic that I am frustrated at an app that is designed to calm the stress in your life. Luckily my wife is in marketing and I promise you this will cost you in having many bloggers with heaving following notified about warning their readers should not use this app.",2019-06-26,"calm"
"209","Bad","https://itunes.apple.com/us/reviews/id862236868","BadDabBad","4.11.1",1,"Bad",2019-06-26,"calm"
"210","Has an annual fee","https://itunes.apple.com/us/reviews/id112696489","Hodsi","4.11.1",1,"Only like 2 or 3 is free the rest you have to pay $70 per month . Not worth it .",2019-06-26,"calm"
"211","Disappointment","https://itunes.apple.com/us/reviews/id114491192","ave the critic","4.11.1",1,"I don’t like how you have to be premium to do anything, I downloaded my favorite song for offline it apparently didn’t work 😡😞",2019-06-26,"calm"
"212","Calm has Actually Saved My Life","https://itunes.apple.com/us/reviews/id116979530","AccraPremium","4.11.1",5,"I have been planning to write this review for quite some time. Last year, I used the Calm App to learn breathing and relaxation techniques that came in handy during a serious health scare. In the darkest moments, I played the App, breathed and stretched myself into a natural resolution, the night before planned surgery. Thank You so much.",2019-06-25,"calm"
"213","Issues with update","https://itunes.apple.com/us/reviews/id270953607","Forbezilla","4.11.1",5,"I love this app but ever since yesterdays update I can’t open it. It keeps crashing and even if it does manage to open it opens directly to the sleep stories and freezes doesn’t even play my background sounds. I love the app very much it has helped improve my sleep greatly, but I’m very frustrated that I can’t do my daily meditation",2019-06-25,"calm"
"214","Worthless","https://itunes.apple.com/us/reviews/id944067848","TRC1118","4.11.1",1,"I tried the app out during the free trial period and cancelled it/unsubscribed on the second day, I then saw a charge on my account from this app for $75, they completely did this without my consent. It is a total scam, there are far better apps out there for the same purpose of this app and for FREE. Don’t waste your time",2019-06-25,"calm"
